{
  "$schema": "https://json-schema.org/draft/2020-12/schema",
  "title": "profile",
  "type": "object",
  "properties": {
    "name": {
      "type": "string",
      "minLength": 1
    },
    "verification": {
      "type": "object",
      "properties": {
        "commands": {
          "type": "array",
          "items": {
            "type": "object",
            "properties": {
              "name": {
                "type": "string",
                "minLength": 1
              },
              "argv": {
                "type": "array",
                "minItems": 1,
                "items": {
                  "type": "string",
                  "minLength": 1
                }
              },
              "timeout_seconds": {
                "type": "integer",
                "minimum": 1
              }
            },
            "required": [
              "name",
              "argv",
              "timeout_seconds"
            ],
            "additionalProperties": false
          }
        },
        "allow_no_tests": {
          "type": "boolean"
        }
      },
      "required": [
        "commands",
        "allow_no_tests"
      ],
      "additionalProperties": false
    },
    "vcs": {
      "type": "object"
    },
    "tracker": {},
    "workspace": {
      "type": "object",
      "required": [
        "repos"
      ],
      "additionalProperties": false,
      "properties": {
        "repos": {
          "type": "array",
          "items": {
            "type": "object",
            "required": [
              "name",
              "path"
            ],
            "additionalProperties": false,
            "properties": {
              "name": {
                "type": "string",
                "minLength": 1
              },
              "path": {
                "type": "string",
                "minLength": 1
              },
              "toolchain": {
                "type": "string"
              }
            }
          }
        }
      }
    },
    "policy": {
      "type": "object",
      "properties": {
        "comments": {
          "type": "string",
          "enum": [
            "existing",
            "minimal",
            "none"
          ]
        },
        "protected_branches": {
          "type": "array",
          "items": {
            "type": "string"
          }
        }
      },
      "additionalProperties": false
    },
    "contracts": {
      "type": "array",
      "items": {
        "type": "object",
        "required": [
          "name",
          "producer",
          "consumers",
          "validation"
        ],
        "properties": {
          "name": {
            "type": "string",
            "minLength": 1
          },
          "producer": {
            "type": "string",
            "minLength": 1
          },
          "consumers": {
            "type": "array",
            "minItems": 1,
            "items": {
              "type": "string",
              "minLength": 1
            }
          },
          "validation": {
            "type": "string",
            "minLength": 1
          }
        },
        "additionalProperties": false
      }
    }
  },
  "required": [
    "name",
    "verification"
  ],
  "additionalProperties": false
}
